### ISSUE TITLE
Bridge DNS stops working randomly

### ISSUE THREAD

**Issue by nnra6864** [containers/aardvark-dns#711]
This is likely similar, or same as #500.
I've been struggling with this for at least a month or 2 now, and it's almost certainly an issue with aardvark-dns.

The way to reproduce it is to use the bridge network, for example:
```yaml
networks:
  forgejo:
    driver: bridge
    name: forgejo
```
And just watch it happen after an hour, a day, or sometimes even longer.
All of a sudden, the container won't be able to resolve anything, be it an external IP, or an IP on the same network such as this:
```
http://forgejo:3000
```

The only way to resolve this is to run `podman system migrate`, and just hope it starts working.
Another solution is using pasta, but then you lose the conveniences of bridge.
I would also like to mention that I am running podman completely rootless.

I also tried hardcoding the DNS:
```
cat ~/.config/containers/containers.conf
[containers]
dns_servers = ["1.1.1.1", "8.8.8.8"]
```
But that's only respected by pasta, custom bridge networks just ignore it:
```
podman exec -it forgejo cat /etc/resolv.conf
search dns.podman .
nameserver 10.89.4.1
```

I am up to provide any additional info that might be needed, just let me know.
Thanks in advance!

**Comment by Luap99** [comment]
please provide basic version information,we only support the latest release so if you do not use that please update to the latest

Other than that there is nothing to go on here, please check your logs, aardvark-dns logs should show up in journald. If this happens again you can also provide proper packet captures (`podman unshare --rootless-netns tcpdump -i any -nn port 53`) and/or strace -f on the aardvark-dns while making dns requests.

As said on the matrix channel it is expect that custom network always use the aardvark-dns ip as it will doe the forwarding to the upstream servers. If you do not want the container name resolution you can create the network with `--disable-dns` which will disable aardvark-dns. (that is not exposed in compose files so you need an external network then)

**Comment by nnra6864** [comment]
```
podman --version
podman version 5.8.3

/usr/lib/podman/netavark --version
netavark 1.17.2
```

I get countless prints in both cases, probably due to having many repository clones on forgejo that are trying to sync:

<details>

<summary>podman unshare --rootless-netns tcpdump -i any -nn port 53</summary>

```
tcpdump: WARNING: any: That device doesn't support promiscuous mode
(Promiscuous mode not supported on the "any" device)
tcpdump: verbose output suppressed, use -v[v]... for full protocol decode
listening on any, link-type LINUX_SLL2 (Linux cooked v2), snapshot length 262144 bytes
11:50:38.588016 veth4 P   IP 10.89.4.2.54134 > 10.89.4.1.53: 22800+ [1au] A? github.com. (51)
11:50:38.588018 podman5 In  IP 10.89.4.2.54134 > 10.89.4.1.53: 22800+ [1au] A? github.com. (51)
11:50:38.588048 veth4 P   IP 10.89.4.2.54134 > 10.89.4.1.53: 48523+ [1au] AAAA? github.com. (51)
11:50:38.588049 podman5 In  IP 10.89.4.2.54134 > 10.89.4.1.53: 48523+ [1au] AAAA? github.com. (51)
11:50:40.590204 veth4 P   IP 10.89.4.2.51448 > 10.89.4.1.53: 22800+ [1au] A? github.com. (51)
11:50:40.590206 podman5 In  IP 10.89.4.2.51448 > 10.89.4.1.53: 22800+ [1au] A? github.com. (51)
11:50:40.590236 veth4 P   IP 10.89.4.2.32892 > 10.89.4.1.53: 48523+ [1au] AAAA? github.com. (51)
11:50:40.590237 podman5 In  IP 10.89.4.2.32892 > 10.89.4.1.53: 48523+ [1au] AAAA? github.com. (51)
11:50:41.951441 veth4 P   IP 10.89.4.2.51356 > 10.89.4.1.53: 34005+ [1au] A? github.com. (51)
11:50:41.951444 podman5 In  IP 10.89.4.2.51356 > 10.89.4.1.53: 34005+ [1au] A? github.com. (51)
11:50:41.951486 veth4 P   IP 10.89.4.2.51356 > 10.89.4.1.53: 22573+ [1au] AAAA? github.com. (51)
11:50:41.951487 podman5 In  IP 10.89.4.2.51356 > 10.89.4.1.53: 22573+ [1au] AAAA? github.com. (51)
11:50:42.601407 veth4 P   IP 10.89.4.2.59426 > 10.89.4.1.53: 22800+ [1au] A? github.com. (51)
11:50:42.601409 podman5 In  IP 10.89.4.2.59426 > 10.89.4.1.53: 22800+ [1au] A? github.com. (51)
11:50:43.951942 veth4 P   IP 10.89.4.2.41296 > 10.89.4.1.53: 34005+ [1au] A? github.com. (51)
11:50:43.951945 podman5 In  IP 10.89.4.2.41296 > 10.89.4.1.53: 34005+ [1au] A? github.com. (51)
11:50:43.951994 veth4 P   IP 10.89.4.2.51112 > 10.89.4.1.53: 22573+ [1au] AAAA? github.com. (51)
11:50:43.951995 podman5 In  IP 10.89.4.2.51112 > 10.89.4.1.53: 22573+ [1au] AAAA? github.com. (51)
11:50:44.156091 veth4 P   IP 10.89.4.2.36830 > 10.89.4.1.53: 48523+ [1au] AAAA? github.com. (51)
11:50:44.156093 podman5 In  IP 10.89.4.2.36830 > 10.89.4.1.53: 48523+ [1au] AAAA? github.com. (51)
11:50:45.957847 veth4 P   IP 10.89.4.2.40374 > 10.89.4.1.53: 34005+ [1au] A? github.com. (51)
11:50:45.957851 podman5 In  IP 10.89.4.2.40374 > 10.89.4.1.53: 34005+ [1au] A? github.com. (51)
11:50:46.008019 veth4 P   IP 10.89.4.2.50351 > 10.89.4.1.53: 22573+ [1au] AAAA? github.com. (51)
11:50:46.008020 podman5 In  IP 10.89.4.2.50351 > 10.89.4.1.53: 22573+ [1au] AAAA? github.com. (51)
11:50:49.130039 veth4 P   IP 10.89.4.2.45458 > 10.89.4.1.53: 43193+ [1au] A? github.com. (51)
11:50:49.130042 podman5 In  IP 10.89.4.2.45458 > 10.89.4.1.53: 43193+ [1au] A? github.com. (51)
11:50:49.130074 veth4 P   IP 10.89.4.2.45458 > 10.89.4.1.53: 15585+ [1au] AAAA? github.com. (51)
11:50:49.130074 podman5 In  IP 10.89.4.2.45458 > 10.89.4.1.53: 15585+ [1au] AAAA? github.com. (51)
^C
28 packets captured
28 packets received by filter
0 packets dropped by kernel
```

</details>

<details>

<summary>journalctl | grep -i aardvark</summary>

```
Jun 26 11:49:18 ergasterion aardvark-dns[876]: 57464 dns request failed: io error: Network is unreachable (os error 101)
Jun 26 11:49:18 ergasterion aardvark-dns[876]: 57464 dns request failed: io error: Network is unreachable (os error 101)
Jun 26 11:49:18 ergasterion aardvark-dns[876]: 58406 dns request failed: io error: Network is unreachable (os error 101)
Jun 26 11:49:20 ergasterion aardvark-dns[876]: 58406 dns request failed: io error: Network is unreachable (os error 101)
Jun 26 11:49:20 ergasterion aardvark-dns[876]: 57464 dns request failed: io error: Network is unreachable (os error 101)
Jun 26 11:49:20 ergasterion aardvark-dns[876]: 58406 dns request failed: io error: Network is unreachable (os error 101)
Jun 26 11:49:20 ergasterion aardvark-dns[876]: 57464 dns request failed: io error: Network is unreachable (os error 101)
Jun 26 11:49:23 ergasterion aardvark-dns[876]: 57464 dns request failed: io error: Network is unreachable (os error 101)
Jun 26 11:49:23 ergasterion aardvark-dns[876]: 57464 dns request failed: io error: Network is unreachable (os error 101)
Jun 26 11:49:24 ergasterion aardvark-dns[876]: 58406 dns request failed: io error: Network is unreachable (os error 101)
Jun 26 11:49:24 ergasterion aardvark-dns[876]: 58406 dns request failed: io error: Network is unreachable (os error 101)
```

</details>

<details>

<summary>cat /etc/resolv.conf</summary>

```
nameserver 127.0.0.53
options edns0 trust-ad
search local n.n
```

</details>

<details>

<summary>podman unshare --rootless-netns ip route</summary>

```
10.89.0.0/24 dev podman1 proto kernel scope link src 10.89.0.1
10.89.1.0/24 dev podman2 proto kernel scope link src 10.89.1.1
10.89.2.0/24 dev podman3 proto kernel scope link src 10.89.2.1
10.89.3.0/24 dev podman4 proto kernel scope link src 10.89.3.1
10.89.4.0/24 dev podman5 proto kernel scope link src 10.89.4.1
10.89.5.0/24 dev podman6 proto kernel scope link src 10.89.5.1
10.89.6.0/24 dev podman7 proto kernel scope link src 10.89.6.1
10.89.7.0/24 dev podman8 proto kernel scope link src 10.89.7.1
192.168.122.0/24 dev virbr0 proto kernel scope link
192.168.122.0/24 dev virbr0 proto kernel scope link src 192.168.122.1
```

</details>

<details>

<summary>podman network inspect forgejo</summary>

```
[
     {
          "name": "forgejo",
          "id": "db113bc29e508e9f08914401ddb4cc273ab2392bf308ebf635ba18afd90eda5e",
          "driver": "bridge",
          "network_interface": "podman5",
          "created": "2026-06-23T09:42:59.433236334+02:00",
          "subnets": [
               {
                    "subnet": "10.89.4.0/24",
                    "gateway": "10.89.4.1"
               }
          ],
          "ipv6_enabled": false,
          "internal": false,
          "dns_enabled": true,
          "labels": {
               "com.docker.compose.project": "forgejo",
               "io.podman.compose.project": "forgejo"
          },
          "ipam_options": {
               "driver": "host-local"
          },
          "containers": {
               "190a058d8ef58b97ffc5302bf3a0d9a772e9f3ce43905c9ff084e58cd45ba937": {
                    "name": "forgejo-runner",
                    "interfaces": {
                         "eth0": {
                              "subnets": [
                                   {
                                        "ipnet": "10.89.4.6/24",
                                        "gateway": "10.89.4.1"
                                   }
                              ],
                              "mac_address": "9e:9f:45:15:d7:d8"
                         }
                    }
               },
               "2710971c3abc675ec9c97695ef768fbd990342dd7264ee4009e3e0d24dd88c51": {
                    "name": "forgejo",
                    "interfaces": {
                         "eth0": {
                              "subnets": [
                                   {
                                        "ipnet": "10.89.4.2/24",
                                        "gateway": "10.89.4.1"
                                   }
                              ],
                              "mac_address": "26:27:79:ca:66:ff"
                         }
                    }
               }
          }
     }
]
```

</details>

<details>

<summary>podman unshare --rootless-netns ping -c1 8.8.8.8</summary>

```
ping: connect: Network is unreachable
```

</details>

<details>

<summary>ip route</summary>

```
default via 192.168.0.1 dev enp3s0 proto dhcp src 192.168.0.10 metric 100
100.64.0.0/16 dev wt0 proto kernel scope link src 100.64.161.113
192.168.0.0/24 dev enp3s0 proto kernel scope link src 192.168.0.10 metric 100
192.168.122.0/24 dev virbr0 proto kernel scope link src 192.168.122.1 linkdown
```

</details>

I should note that I wasn't sure what info would be relevant, so I asked ai to suggest the commands I should paste the output of, so I apologize if something is unrelated.

**Comment by Luap99** [comment]
Well from that the issue is quite clear your rootless netns has no external connection at all (no default route) so this has nothing to do with dns. A ping from the container should not work either.

How does the routes/interfaces on the host look like. This sounds more case pasta was started when your network was not yet up/ready. i.e. I assume pasta choose virb0 to copy and that one has no default route.

See https://github.com/podman-container-tools/podman/issues/24637 https://github.com/podman-container-tools/podman/issues/24796 https://blog.podman.io/2024/10/podman-5-3-changes-for-improved-networking-experience-with-pasta/  or countless other issue on the podman repo about this thing.

If your containers start to early on boot they will get the wrong network config

**Comment by nnra6864** [comment]
Ok, so thanks to your suggestions, I think I might've fixed it, but I am not yet sure, will have to wait and see.

First, I edited the podman-restart service:
```sh
systemctl --user edit podman-restart.service
```
And added the following:
```toml
[Unit]
Wants=podman-user-wait-network-online.service
After=podman-user-wait-network-online.service
```

Then I disabled the system restart service and enabled the user one:
```sh
systemctl disable podman-restart.service
systemctl --user enable --now podman-restart.service
```

I rebooted and all seems good without `podman system migrate` for now.
I'll post an update if it breaks again, but this is such a weird bug, and why isn't the default service already wanting/running after `podman-user-wait-network-online.service`?
Really appreciate your help and time, thanks!
